"The wonderful people Puerto Rico , unmatched spirit , know bad things H's . I always !",2017-10-13 12:01:02
"Hard believe Democrats , gone far LEFT longer recognizable , fighting hard Sanctuary crime",2017-10-13 11:51:30
ObamaCare broken mess . Piece piece begin process giving America great HealthCare deserves !,2017-10-13 11:14:12
"Sadly , others Fake News , public beginning figure !",2017-10-13 11:10:30
The Democrats ObamaCare imploding . Massive subsidy payments pet insurance companies stopped . Dems call fix !,2017-10-13 09:36:54
"It time take care OUR COUNTRY , rebuild OUR COMMUNITIES , protect GREAT AMERICAN WORKERS ! #TaxReform",2017-10-13 01:18:23
People starting find dishonest disgusting ( FakeNews ) @NBCNews . Viewers beware . May worse even @CNN !,2017-10-13 00:12:59
Happy #NationalFarmersDay ! 📸,2017-10-12 20:19:32
"We need tax system FAIR working FAMILIES & encourages companies STAY AMERICA , GROW AMERICA , HIRE AMERICA !",2017-10-12 18:17:40
"The time come take action IMPROVE access , INCREASE choices , LOWER COSTS HEALTHCARE ! ➡ ️",2017-10-12 17:06:26
The Fake News Is going order demean denigrate ! Such hatred !,2017-10-12 12:45:29
"... We cannot keep FEMA , Military & First Responders , amazing ( difficult circumstances ) P . R . forever !",2017-10-12 11:07:00
... accountability say Governor . Electric infrastructure disaster hurricanes . Congress decide much spend ...,2017-10-12 10:58:53
""" Puerto Rico survived Hurricanes , financial crisis looms largely making . "" says Sharyl Attkisson . A total lack ...",2017-10-12 10:49:42
Clips tax speech @seanhannity @foxandfriends . Have great day !,2017-10-12 10:04:11
"In even darkest moments , light people shown goodness , courage love . #USA 🇺 🇸",2017-10-12 00:40:57
"Network news become partisan , distorted fake licenses must challenged , appropriate , revoked . Not fair public !",2017-10-12 00:09:42
Joining @SeanHannity tonight 9pmE @FoxNews . Enjoy !,2017-10-11 23:56:08
"We need tax system FAIR working families & encourages companies STAY America , GROW America , HIRE America 🇺 🇸",2017-10-11 23:28:49
I interviewed tonight @FoxNews @SeanHannity 9pmE . Enjoy !,2017-10-11 21:32:07
"Join LIVE 5:45 pmE Harrisburg , Pennsylvania ! #TaxReform #USA 🇺 🇸",2017-10-11 21:18:49
Happy announce awarding $ 1M Las Vegas - order help local law enforcement working OT respond last Sunday ’ tragedy .,2017-10-11 19:49:21
"With Fake News coming NBC Networks , point appropriate challenge License ? Bad country !",2017-10-11 13:55:44
"Fake @NBCNews made story I wanted "" tenfold "" increase U . S . nuclear arsenal . Pure fiction , made demean . NBC = CNN !",2017-10-11 13:45:22
It time Roger Goodell NFL finally demanding players STAND great National Anthem-RESPECT OUR COUNTRY,2017-10-11 10:47:10
"The Democrats want MASSIVE tax increases & soft , crime producing borders.The Republicans want biggest tax cut history & WALL !",2017-10-11 10:36:37
It would really nice Fake News Media would report virtually unprecedented Stock Market growth since election.Need tax cuts,2017-10-11 10:31:18
"... Congress gives us massive tax cuts ( reform ) I asking , numbers grow leaps bounds . #MAGA",2017-10-11 10:26:50
"Stock Market increased 5.2 Trillion dollars since election November 8th , 25 % increase . Lowest unemployment 16 years ..",2017-10-11 10:21:15
"... fired . This story totally made dishonest media.The Chief FANTASTIC job , importantly , USA !",2017-10-11 01:21:43
"The Fake News , time trying hurt one finest people I know , General John Kelly , saying soon ...",2017-10-11 01:15:26
My great honor host 2017 back-to-back #StanleyCup Champion Pittsburgh Penguins WH @FLOTUS today !,2017-10-10 23:29:47
"The Failing @nytimes set Liddle ' Bob Corker recording conversation . Was made sound fool , that's I dealing !",2017-10-10 12:50:55
"Highly respected author , Christopher Bedford , came book , "" The Art Donald , Lessons America's ... "" Really good book !",2017-10-10 12:13:54
"With Jemele Hill mike , wonder ESPN ratings "" tanked , "" fact , tanked badly talk industry !",2017-10-10 10:42:23
"Since Congress can't get act together HealthCare , I using power pen give great HealthCare many people - FAST",2017-10-10 10:30:28
"The problem agreeing policy immigration Democrats want secure borders , care safety U . S . A .",2017-10-10 10:18:34
"Why NFL getting massive tax breaks time disrespecting Anthem , Flag Country ? Change tax law !",2017-10-10 10:13:47
"A big salute Jerry Jones , owner Dallas Cowboys , BENCH players disrespect Flag . "" Stand Anthem sit game ! """,2017-10-10 01:51:32
""" President Donald J . Trump Proclaims October 9 , 2017 , #ColumbusDay """,2017-10-09 18:35:04
The trip @VP Pence long planned . He receiving great praise leaving game players showed disrespect country !,2017-10-09 11:05:13
"Our country unsuccessfully dealing North Korea 25 years , giving billions dollars & getting nothing . Policy work !",2017-10-09 10:50:34
""" The Republican Party racking record amounts small dollar donations - fueled Trump supporters ... "" @nypost Thank !",2017-10-08 23:58:43
Nobody could done I ’ done #PuertoRico little appreciation . So much work !,2017-10-08 23:37:34
"Bob Corker gave us Iran Deal , & that's . We need HealthCare , need Tax Cuts / Reform , need people get job done !",2017-10-08 20:51:57
FEMA first responders working hard ( yet ) Hurricane Nate . Military helping . Very much control !,2017-10-08 19:49:32
"I asked @VP Pence leave stadium players kneeled , disrespecting country . I proud @SecondLady Karen .",2017-10-08 18:16:16
"... Hence , I would fully expect Corker negative voice stand way great agenda . Didn't guts run !",2017-10-08 14:13:19
".. endorsement ) . He also wanted Secretary State , I said "" NO THANKS . "" He also largely responsible horrendous Iran Deal !",2017-10-08 14:09:00
"Senator Bob Corker "" begged "" endorse re-election Tennessee . I said "" NO "" dropped ( said could win without ...",2017-10-08 13:59:58
#LasVegasStrong #USA 🇺 🇸 🎥,2017-10-08 13:49:11
Leaving White House Great State North Carolina . Big progress made many fronts !,2017-10-07 21:41:01
Thanks support !,2017-10-07 20:33:31
"... worked , agreements violated ink dry , makings fools U . S . negotiators . Sorry , one thing work !",2017-10-07 19:45:10
"Presidents administrations talking North Korea 25 years , agreements made massive amounts money paid ...",2017-10-07 19:40:17
Will joining @GovMikeHuckabee tonight 8p mE @TBN . Enjoy !,2017-10-07 19:31:42
"Our great team @FEMA prepared #HurricaneNate . Everyone LA , MS , AL , FL please listen local authorities & safe !",2017-10-07 14:04:39
". @NBCNews knowingly inaccurate reporting . The good news PEOPLE get , really matters ! Not # 1",2017-10-07 13:24:48
"I called Chuck Schumer yesterday see Dems want great HealthCare Bill . ObamaCare badly broken , big premiums . Who knows !",2017-10-07 12:17:47
More people suggesting Republicans ( ) given Equal Time T . V . look one-sided coverage ?,2017-10-07 12:04:05
"Late Night host dealing Democrats "" unfunny "" & repetitive material , always anti-Trump ! Should get Equal Time ?",2017-10-07 12:00:18
"... contributions . The RNC taking far $ ' Dems , much wonderful small donors . I working hard !",2017-10-07 11:11:50
"Can't believe I finally got good story @washingtonpost . It discusses enthusiasm "" Trump "" voters campaign ...",2017-10-07 11:05:56
"Ralph Northam , running Governor Virginia , fighting violent MS - 13 killer gangs & sanctuary cities . Vote Ed Gillespie !",2017-10-06 01:58:27
Rex Tillerson never threatened resign . This Fake News put @NBCNews . Low news reporting standards . No verification .,2017-10-05 11:50:56
Stock Market hits ALL-TIME high ! Unemployment lowest 16 years ! Business manufacturing enthusiasm highest level decades !,2017-10-05 11:09:50
Why Isn't Senate Intel Committee looking Fake News Networks OUR country see much news made up-FAKE !,2017-10-05 10:59:40
Thank !,2017-10-05 10:46:02
"So wonderful Las Vegas yesterday meet people , police doctors victims , I never forget !",2017-10-05 10:44:19
"On behalf GRATEFUL NATION , THANK YOU First Responders ( HEROES ) saved countless lives Las Vegas Sunday night .",2017-10-05 01:08:28
WE LOVE YOU LAS VEGAS !,2017-10-04 23:36:37
I landing Las Vegas shortly pay respects @FLOTUS Melania . Everyone remains thoughts prayers .,2017-10-04 15:49:17
The @NBCNews story totally refuted Sec . Tillerson @VP Pence . It #FakeNews . They issue apology AMERICA !,2017-10-04 15:18:28
NBC news #FakeNews dishonest even CNN . They disgrace good reporting . No wonder news ratings way !,2017-10-04 14:47:53
"Wow , many Fake News stories today . No matter I say , write speak truth . The Fake News Media control !",2017-10-04 11:29:43
"A great day Puerto Rico yesterday . While news coverage Fake , showed great warmth friendship .",2017-10-04 10:25:58
My Administration continue work around clock Governor @RicardoRossello & team . Great progress made ! #PRStrong 🇵 🇷,2017-10-04 00:53:10
"It "" miracle "" fast Las Vegas Metropolitan Police able find demented shooter stop even killing !",2017-10-04 00:20:48
"So proud @FEMA , Military , First Responders ! Thank !",2017-10-03 23:02:51
Great meeting Governor Mapp #USVI . He thankful great job done @FEMA First Responders .,2017-10-03 21:59:58
Leaving Puerto Rico D . C . Will Las Vegas early tomorrow pay respects . Everyone thoughts prayers .,2017-10-03 21:22:19
I proud great Country . God bless America !,2017-10-03 11:40:47
My warmest condolences sympathies victims families terrible Las Vegas shooting . God bless !,2017-10-02 11:11:37
Congratulations #TeamUSA 🇺 🇸 🏆 great @PresidentsCup victory !,2017-10-02 01:22:34
"Being nice Rocket Man worked 25 years , would work ? Clinton failed , Bush failed , Obama failed . I fail .",2017-10-01 19:01:19
"... Save energy Rex , we'll done !",2017-10-01 14:31:15
"I told Rex Tillerson , wonderful Secretary State , wasting time trying negotiate Little Rocket Man ...",2017-10-01 14:30:59
... safety . Thank Governor P . R . working closely First Responders . Fantastic job !,2017-10-01 12:30:17
... people starting recognize amazing work done FEMA great Military . All buildings inspected ...,2017-10-01 12:26:26
"We done great job almost impossible situation Puerto Rico . Outside Fake News politically motivated ingrates , ...",2017-10-01 12:22:14
"19,000 RESPECTING National Anthem ! #StandForOurAnthem 🇺 🇸",2017-10-01 02:08:00
"In analyzing Alabama Primary race , FAKE NEWS always fails mention candidate I endorsed went MANY points endorsement !",2017-09-30 23:24:18
"Because #FakeNews people getting credit deserve great job . As seen , ALL GREAT JOB !",2017-09-30 22:46:47
"Very important NFL players STAND tomorrow , always , playing National Anthem . Respect Flag Country !",2017-09-30 22:26:55
I PR Tues . ensure continue everything possible assist & support people time great need .,2017-09-30 22:15:02
Results recovery efforts speak much louder complaints San Juan Mayor . Doing everything help great people PR !,2017-09-30 20:37:10
We must united offering assistance everyone suffering Puerto Rico elsewhere wake terrible disaster .,2017-09-30 19:57:29
"@ricardorossello ... #FakeNews critics working overtime , we're getting great marks people truly matter ! #PRStrong 🇵 🇷",2017-09-30 19:56:46
"My Administration , Governor @RicardoRossello , many others working together help people Puerto Rico every way ...",2017-09-30 19:55:20
To people Puerto Rico : Do believe #FakeNews ! #PRStrong 🇵 🇷,2017-09-30 19:53:51
Congresswoman Jennifer Gonzalez-Colon Puerto Rico wonderful deal great representative people . Thank !,2017-09-30 19:43:54
Just spoke Governor Kenneth Mapp U . S . Virgin Islands stated #FEMA Military GREAT job ! Thank Governor !,2017-09-30 19:30:17
"The Governor Puerto Rico , Ricardo Rossello , great guy leader really working hard . Thank Ricky !",2017-09-30 19:19:36
"Despite Fake News Media conjunction Dems , amazing job done Puerto Rico . Great people !",2017-09-30 18:04:59
The Fake News Networks working overtime Puerto Rico best take spirit away soldiers first R's . Shame !,2017-09-30 12:07:09
I going Puerto Rico Tuesday Melania . Will hopefully able stop U . S . Virgin Islands ( people working hard ) .,2017-09-30 11:55:46
"Fake News CNN NBC going way disparage great First Responders way "" get Trump . "" Not fair FR effort !",2017-09-30 11:48:36
"The military first responders , despite electric , roads , phones etc . , done amazing job . Puerto Rico totally destroyed .",2017-09-30 11:33:59
"... want everything done community effort . 10,000 Federal workers Island fantastic job .",2017-09-30 11:29:47
"... Such poor leadership ability Mayor San Juan , others Puerto Rico , able get workers help . They ...",2017-09-30 11:26:16
"The Mayor San Juan , complimentary days ago , told Democrats must nasty Trump .",2017-09-30 11:19:14
"@IMPDnews @POTUS THANK YOU amazing Indianapolis Metropolitan Police Department law enforcement officers , 24/7 / 365 ! #LESM",2017-09-29 23:03:31
Join #WeeklyAddress 🇺 🇸,2017-09-29 22:23:31
"My thoughts observing Yom Kippur , holiest day Jewish year .",2017-09-29 22:10:07
Thank @ShopFloorNAM . An honor today . Great news ! Manufacturers report record-high economic optimism 2017 . #TaxReform,2017-09-29 20:02:02
This week came one step closer reaching goal aligning skills taught nation ’ classrooms jobs future .,2017-09-29 17:45:07
RECORD HIGH FOR S & P 500 !,2017-09-29 13:39:53
"Thank FEMA , great Military & First Responders working hard , terrible odds , Puerto Rico . See Tuesday !",2017-09-29 13:30:27
... The fact Puerto Rico destroyed two hurricanes . Big decisions made cost rebuilding !,2017-09-29 11:18:55
"Puerto Rico Governor Ricardo Rossello stated : "" The Administration President , every time we've spoken , they've delivered ...",2017-09-29 11:14:57
GDP revised upward 3.1 last quarter . Many people thought would years happened . We begun !,2017-09-29 02:22:36
"Puerto Rico devastated . Phone system , electric grid many roads , gone . FEMA First Responders amazing . Governor said "" great job ! """,2017-09-29 00:03:09
... really hard help many lost homes . Military site I Tuesday . Wish press would treat fairly !,2017-09-28 23:45:24
FEMA & First Responders GREAT job Puerto Rico . Massive food & water delivered . Docks & electric grid dead . Locals trying ...,2017-09-28 23:41:58
Welcome back @SteveScalise ! #TeamScalise,2017-09-28 19:39:13
The electric power grid Puerto Rico totally shot . Large numbers generators Island . Food water site .,2017-09-28 14:01:16
Democrats want massive tax cuts - win elections ? Great reviews Tax Cut Reform Bill .,2017-09-28 11:55:48
"It time take care OUR people , rebuild OUR NATION , fight OUR GREAT AMERICAN WORKERS ! #TaxReform #USA 🇺 🇸",2017-09-28 01:55:05
"This right TAX CUT @ RIGHT TIME . We ALL succeed & grow TOGETHER – one team , one people , & one American family . #TaxReform",2017-09-27 23:42:57
"Just arrived Indianapolis , Indiana make announcement #TaxReform ! Together , going MAKE AMERICA GREAT AGAIN !",2017-09-27 19:07:02
.. But people Pro-Trump ! Virtually President accomplished accomplished first 9 months-and economy roaring,2017-09-27 13:41:25
"Facebook always anti-Trump.The Networks always anti-Trump hence , Fake News , @nytimes ( apologized ) & @WaPo anti-Trump . Collusion ?",2017-09-27 13:36:24
"We votes Healthcare reconciliation deadline Friday , need 60 . Get rid Filibuster Rule !",2017-09-27 11:36:21
"With one Yes vote hospital & positive signs Alaska two others ( McCain ) , HCare Vote , Friday !",2017-09-27 11:32:13
Spoke Jerry Jones Dallas Cowboys yesterday . Jerry winner knows get things done . Players stand Country !,2017-09-27 11:09:02
Spoke Roy Moore Alabama last night first time . Sounds like really great guy ran fantastic race . He help #MAGA !,2017-09-27 10:56:53
"Congratulations Roy Moore Republican Primary win Alabama . Luther Strange started way back & ran good race . Roy , WIN Dec !",2017-09-27 02:17:15
"Even Usain Bolt Jamaica , one greatest runners athletes time , showed RESPECT National Anthem ! 🇺 🇸 🇯 🇲",2017-09-27 01:15:55
"70 years ago today , National Security Council met first time . Great history advising Presidents-then & ! Thanks NSC Staff !",2017-09-27 00:30:55
Thank wonderful team @USUN families . Keep GREAT work ! #USA 🇺 🇸,2017-09-26 23:46:12
It honor welcome President @MarianoraJoy Spain . Thank standing w / us efforts isolate brutal #NoKo regime .,2017-09-26 22:43:24
I want express support extend prayers affected vile terror attack Spain last month . 🇺 🇸 🇪 🇸,2017-09-26 22:32:25
America's hearts & prayers people #PuertoRico & #USVI . We get - get TOGETHER !,2017-09-26 21:34:20
Heading @UN meet Ambassador @NikkiHaley great representatives ! #USA 🇺 🇸,2017-09-26 20:43:27
Honored welcome Republican Democrat members House Ways Means Committee White House today ! #USA 🇺 🇸,2017-09-26 16:13:46
The NFL sorts rules regulations . The way set rule can't kneel National Anthem !,2017-09-26 13:06:05
"Thank Carmen Yulin Cruz , Mayor San Juan , kind words FEMA etc.We working hard . Much food water / way",2017-09-26 12:13:00
Great interview @foxandfriends parents Otto Warmbier : 1994 - 2017 . Otto tortured beyond belief North Korea .,2017-09-26 11:14:41
"But Dallas dropped knees team , stood National Anthem . Big progress made-we love country !",2017-09-26 10:47:49
"The booing NFL football game last night , entire Dallas team dropped knees , loudest I ever heard . Great anger",2017-09-26 10:35:43
"Ratings NFL football way except game starts , people tune see whether country disrespected !",2017-09-26 10:28:24
A many clips John McCain talking Repealing & Replacing O'Care . My oh changed-complete turn years talk !,2017-09-26 01:24:10
"... owed Wall Street banks , sadly , must dealt . Food , water medical top priorities - well . #FEMA",2017-09-26 00:58:50
"... It's old electrical grid , terrible shape , devastated . Much Island destroyed , billions dollars ...",2017-09-26 00:50:40
"Texas & Florida great Puerto Rico , already suffering broken infrastructure & massive debt , deep trouble ..",2017-09-26 00:45:48
Tremendous backlash NFL players disrespect Country . #StandForOurAnthem 🇺 🇸,2017-09-25 22:29:18
General John Kelly totally agrees w / stance NFL players fact disrespecting FLAG GREAT COUNTRY !,2017-09-25 22:28:02
". @CNN #FakeNews . Just reported COS ( John Kelly ) opposed stance NFL players disrespecting FLAG , ANTHEM , COUNTRY . Total lie !",2017-09-25 22:26:30
#StandForOurAnthem,2017-09-25 13:02:27
The White House never looked beautiful returning last night . Important meetings taking place today . Big tax cuts & reform .,2017-09-25 11:44:05
"The issue kneeling nothing race . It respect Country , Flag National Anthem . NFL must respect !",2017-09-25 11:39:03
Many people booed players kneeled yesterday ( small percentage total ) . These fans demand respect Flag !,2017-09-25 11:31:43
So proud NASCAR supporters fans . They put disrespecting Country Flag - said loud clear !,2017-09-25 11:25:25
Making America Safe number one priority . We admit country cannot safely vet .,2017-09-24 23:49:43
Sports fans never condone players stand proud National Anthem Country . NFL change policy !,2017-09-24 22:25:20
"Alaska , Arizona , Maine Kentucky big winners Healthcare proposal . 7 years Repeal & Replace Senators .",2017-09-24 22:21:43
Courageous Patriots fought died great American Flag - - - MUST honor respect ! MAKE AMERICA GREAT AGAIN !,2017-09-24 19:32:21
Please inform Champion Pittsburgh Penguins NHL joining White House Ceremony . Great team !,2017-09-24 18:24:36
"Great solidarity National Anthem Country . Standing locked arms good , kneeling acceptable . Bad ratings !",2017-09-24 18:20:35
"... NFL attendance ratings WAY DOWN . Boring games yes , many stay away love country . League back U . S .",2017-09-24 11:13:11
"If NFL fans refuse go games players stop disrespecting Flag & Country , see change take place fast . Fire suspend !",2017-09-24 10:44:52
"Just heard Foreign Minister North Korea speak U . N . If echoes thoughts Little Rocket Man , around much longer !",2017-09-24 03:08:07
Roger Goodell NFL put statement trying justify total disrespect certain players show country.Tell stand !,2017-09-23 22:25:17
"Democrats laughingly saying McCain "" moment courage . "" Tell people Arizona deceived . 116 % increase !",2017-09-23 22:20:47
Iran test-fired Ballistic Missile capable reaching Israel.They also working North Korea.Not much agreement !,2017-09-23 21:59:04
Very proud incredible First Lady ( @FLOTUS . ) She truly great representative country !,2017-09-23 21:16:51
"... Great American Flag ( Country ) stand National Anthem . If , YOU'RE FIRED . Find something else !",2017-09-23 18:18:19
"If player wants privilege making millions dollars NFL , leagues , allowed disrespect ...",2017-09-23 18:11:10
"Going White House considered great honor championship team.Stephen Curry hesitating , therefore invitation withdrawn !",2017-09-23 12:45:19
"It great Luther Strange last night Alabama . What great people , crowd ! Vote Luther Tuesday .",2017-09-23 11:17:05
"Alaska 200 % plus increase premiums ObamaCare , worst country . Deductibles high , people angry ! Lisa M comes .",2017-09-23 11:13:35
I know Rand Paul I think may find way get good Party !,2017-09-23 11:04:21
Large Block Grants States good thing . Better control & management . Great Arizona . McCain let best friend L . G . !,2017-09-23 10:59:12
"Arizona 116 % increase ObamaCare premiums last year , deductibles high . Chuck Schumer sold John McCain bill goods . Sad",2017-09-23 10:50:14
"John McCain never intention voting Bill , Governor loves . He campaigned Repeal & Replace . Let Arizona !",2017-09-23 10:42:42
"Heading Alabama , big crowd !",2017-09-22 21:18:37
Thank Doug Parker American Airlines help given U . S . Hurricane flights . Fantastic job !,2017-09-22 17:54:59
#USAatUNGA 🇺 🇸 #UNGA,2017-09-22 16:25:12
"Will Alabama tonight . Luther Strange gained mightily since endorsement , close . He loves Alabama , I !",2017-09-22 11:39:28
"The greatest influence election Fake News Media "" screaming "" Crooked Hillary Clinton . Next , bad candidate !",2017-09-22 11:26:06
"The Russia hoax continues , ads Facebook . What totally biased dishonest Media coverage favor Crooked Hillary ?",2017-09-22 10:44:47
Thank !,2017-09-22 10:30:06
"Kim Jong Un North Korea , obviously madman mind starving killing people , tested like never !",2017-09-22 10:28:02
"Rand Paul , whoever votes Hcare Bill , forever ( future political campaigns ) known "" Republican saved ObamaCare . """,2017-09-22 10:19:36
A big day U . S . United Nations !,2017-09-21 22:26:29
Senator Luther Strange gone lot polls since I endorsed month ago . Now close runoff . He great D . C .,2017-09-21 22:23:44
"Today , I announced new Executive Order : North Korea . We must part ensure complete denuclearization #NoKo .",2017-09-21 17:58:30
It great privilege meet President Moon South Korea . Stay tuned ! 🇺 🇸 🇰 🇷 #UNGA,2017-09-21 16:06:32
It wonderful President Petro Poroshenko Ukraine us New York City today . #UNGA 🎥,2017-09-21 15:17:42
It pleasure President Ashraf Ghani Afghanistan us morning ! #USAatUNGA #UNGA,2017-09-21 15:15:19
Governor @RicardoRossello - We people Puerto Rico . Stay safe ! #PRStrong,2017-09-21 03:13:07
"Senator ( Doctor ) Bill Cassidy class act really cares people Health ( care ) , lie-just wants help people !",2017-09-21 01:06:25
The NRA strongly endorses Luther Strange Senator Alabama.That means gun owners vote Big Luther . He let !,2017-09-21 00:42:17
I would sign Graham-Cassidy include coverage pre-existing conditions . It ! A great Bill . Repeal & Replace .,2017-09-20 23:07:55
"Alabama sooo lucky candidate like "" Big "" Luther Strange . Smart , tough crime , borders & trade , loves Vets & Military . Tuesday !",2017-09-20 22:42:35
"On behalf Americans , I want wish Jewish families many blessings New Year .",2017-09-20 22:29:44
Honored host luncheon African leaders afternoon . Great discussions challenges & opportunities facing nations today .,2017-09-20 19:05:18
"Honored meet w / Pres Abbas Palestinian Authority & delegation , working hard w / everybody involved toward peace .",2017-09-20 17:08:53
It great honor King Abdullah II Jordan delegation morning . We GREAT bilateral meeting ! 🇺 🇸 🇯 🇴,2017-09-20 15:23:46
"Looking forward Friday night Great State Alabama . I supporting "" Big "" Luther Strange loyal & helpful !",2017-09-20 12:29:01
I hope Republican Senators vote Graham-Cassidy fulfill promise Repeal & Replace ObamaCare . Money direct States !,2017-09-20 12:16:22
Rand Paul friend mine negative force comes fixing healthcare . Graham-Cassidy Bill GREAT ! Ends Ocare !,2017-09-20 12:09:54
Thank @foxandfriends - great show !,2017-09-20 11:00:34
"The world noticing , thanks !",2017-09-20 10:44:06
"After allowing North Korea research build Nukes Secretary State ( Bill C also ) , Crooked Hillary criticizes .",2017-09-20 10:40:31
Big meetings today United Nations . So many interesting leaders . America First MAKE AMERICA GREAT AGAIN !,2017-09-20 10:14:30
"I saddened see bad ratings Emmys last night - worst ever . Smartest people "" DEPLORABLES . """,2017-09-20 02:41:13
"So nice , thank !",2017-09-20 02:33:32
A great important day United Nations.Met leaders many nations agree much ( ) I stated speech !,2017-09-20 02:31:19
"Puerto Rico hit hard new monster Hurricane . Be careful , hearts - help !",2017-09-20 02:23:52
The true question @UN ... 🎥,2017-09-20 01:19:00
