"Many reports peaceful protests Iranian citizens fed regime ’ corruption & squandering nation ’ wealth fund terrorism abroad . Iranian govt respect people ’ rights , including right express . The world watching ! #IranProtests",2017-12-30 03:42:58
"The Democrats told , fully understand , DACA without desperately needed WALL Southern Border END horrible Chain Migration & ridiculous Lottery System Immigration etc . We must protect Country cost !",2017-12-29 13:16:11
"Why United States Post Office , losing many billions dollars year , charging Amazon others little deliver packages , making Amazon richer Post Office dumber poorer ? Should charging MUCH MORE !",2017-12-29 13:04:09
"While Fake News loves talk so-called low approval rating , @foxandfriends showed rating Dec . 28 , 2017 , approximately President Obama Dec . 28 , 2009 , 47 % ... despite massive negative Trump coverage & Russia hoax !",2017-12-29 12:46:23
"In East , could COLDEST New Year ’ Eve record . Perhaps could use little bit good old Global Warming Country , countries , going pay TRILLIONS OF DOLLARS protect . Bundle !",2017-12-29 00:01:47
"Together , MAKING AMERICA GREAT AGAIN !",2017-12-28 23:14:21
"I've saying long , long time . #NoKo",2017-12-28 19:20:47
Caught RED HANDED - disappointed China allowing oil go North Korea . There never friendly solution North Korea problem continues happen !,2017-12-28 16:24:08
Retail sales record numbers . We ’ got economy going better anyone ever dreamt - ’ seen anything yet !,2017-12-28 16:18:20
"Vanity Fair , looks like last legs , bending backwards apologizing minor hit took Crooked H . Anna Wintour , set Amb Court St James ’ & big fundraiser CH , beside grief & begging forgiveness !",2017-12-28 15:24:53
"“ Arrests MS - 13 Members , Associates Up 83 % Under Trump ”",2017-12-28 02:46:30
"“ On 1/20 - day Trump inaugurated - estimated 35,000 ISIS fighters held approx 17,500 square miles territory Iraq Syria . As 12/21 , U . S . military est remaining 1,000 fighters occupy roughly 1,900 square miles .. ” @jamiejmcintyre @dcexaminer",2017-12-28 02:09:22
"Just left West Palm Beach Fire & Rescue # 2 . Met great men women representatives much us . Firefighters , paramedics , first responders - amazing people !",2017-12-27 23:11:13
"All signs business looking really good next year , helped Tax Cut Bill . Will great year Companies JOBS ! Stock Market poised another year SUCCESS !",2017-12-26 22:17:14
"WOW , @foxandfrlends “ Dossier bogus . Clinton Campaign , DNC funded Dossier . FBI CANNOT ( time ) VERIFY CLAIMS IN DOSSIER OF RUSSIA / TRUMP COLLUSION . FBI TAINTED . ” And used Crooked Hillary pile garbage basis going Trump Campaign !",2017-12-26 13:24:27
"Based fact unfair unpopular Individual Mandate terminated part Tax Cut Bill , essentially Repeals ( time ) ObamaCare , Democrats & Republicans eventually come together develop great new HealthCare plan !",2017-12-26 11:58:42
"I hope everyone great Christmas , tomorrow ’ back work order Make America Great Again ( happening faster anyone anticipated ) !",2017-12-25 23:33:55
MERRY CHRISTMAS ! ! !,2017-12-25 13:36:51
MERRY CHRISTMAS ! !,2017-12-25 03:51:52
People proud saying Merry Christmas . I proud led charge assault cherished beautiful phrase . MERRY CHRISTMAS ! ! !,2017-12-25 02:56:19
"The Tax Cut / Reform Bill , including Massive Alaska Drilling Repeal highly unpopular Individual Mandate , brought together incredible year . Don ’ let Fake News convince otherwise ... insider Polls strong !",2017-12-24 20:35:26
"The Fake News refuses talk Big Strong BASE . They show Fake Polls like report Fake News . Despite negative reporting , well - nobody going beat us . MAKE AMERICA GREAT AGAIN !",2017-12-24 13:48:11
". @FoxNews - FBI ’ Andrew McCabe , “ addition wife getting money M ( Clinton Puppet ) , using , allegedly , FBI Official Email Account promote campaign . You obviously cannot . These people investigating Hillary Clinton . ”",2017-12-24 12:25:22
"Remember , Republicans 5-0 Congressional races year . In Senate , I said Roy M would lose Alabama supported Big Luther Strange - Roy lost . Virginia candidate “ Trumper , ” lost . Good Republican candidates win BIG !",2017-12-23 22:57:50
"The Stock Market setting record record unemployment 17 year low . So many things accomplished Trump Administration , perhaps President first year . Sadly , never reported correctly Fake News Media !",2017-12-23 22:44:45
"Wow , “ FBI lawyer James Baker reassigned , ” according @FoxNews .",2017-12-23 20:32:42
FBI Deputy Director Andrew McCabe racing clock retire full benefits . 90 days go ? ! ! !,2017-12-23 20:30:06
"How FBI Deputy Director Andrew McCabe , man charge , along leakin ’ James Comey , Phony Hillary Clinton investigation ( including 33,000 illegally deleted emails ) given $ 700,000 wife ’ campaign Clinton Puppets investigation ?",2017-12-23 20:27:05
"Remember , hated part ObamaCare Individual Mandate , terminated signed Tax Cut Bill .",2017-12-22 22:11:56
"Today , great honor sign largest TAX CUTS reform history country . Full remarks :",2017-12-22 20:47:43
"The United Nations Security Council voted 15-0 favor additional Sanctions North Korea . The World wants Peace , Death !",2017-12-22 20:47:15
"Congressman Ron DeSantis brilliant young leader , Yale Harvard Law , would make GREAT Governor Florida . He loves Country true FIGHTER !",2017-12-22 18:40:29
"95 % Americans pay less , worst , amount taxes ( mostly far less ) . The Dems want raise taxes !",2017-12-22 16:46:49
Will signing biggest ever Tax Cut Reform Bill 30 minutes Oval Office . Will also signing much needed 4 billion dollar missile defense bill .,2017-12-22 15:07:55
"With Administration done Legislative Approvals ( broke Harry Truman ’ Record ) , Regulation Cutting , Judicial Appointments , Building Military , VA , TAX CUTS & REFORM , Record Economy / Stock Market much , I sure great credit given mainstream news ?",2017-12-22 15:04:39
"“ The President accomplished absolutely historic things past year . ” Thank Charlie Kirk Turning Points USA . Sadly , Fake Mainstream Media NEVER talk accomplishments end year reviews . We compiling long & beautiful list .",2017-12-22 14:17:04
"At point , good country , I predict start working Democrats Bipartisan fashion . Infrastructure would perfect place start . After foolishly spent $ 7 trillion Middle East , time start rebuilding country !",2017-12-22 13:05:06
So true !,2017-12-22 12:50:42
"Our big popular Tax Cut Reform Bill taken unexpected new source “ love ” - big companies corporations showering workers bonuses . This phenomenon nobody even thought , rage . Merry Christmas !",2017-12-22 12:47:51
"THANK YOU everyone joined @WhiteHouse yesterday . Together , MAKING AMERICA GREAT AGAIN !",2017-12-21 18:16:28
"House Democrats want SHUTDOWN holidays order distract popular , passed , Tax Cuts . House Republicans , ’ let happen . Pass C . R . TODAY keep Government OPEN !",2017-12-21 14:52:22
Home Sales hit BEST numbers 10 years ! MAKE AMERICA GREAT AGAIN,2017-12-21 13:56:28
Was @foxandfriends named influential show news ? You deserve - three great people ! The many Fake News Hate Shows study formula success !,2017-12-21 12:45:17
"The Massive Tax Cuts , Fake News Media desperate write badly please Democrat bosses , soon kicking speak . Companies already making big payments workers . Dems want raise taxes , hate big Cuts !",2017-12-21 12:24:22
WE ARE MAKING AMERICA GREAT AGAIN !,2017-12-20 21:44:50
We delivering HISTORIC TAX RELIEF American people ! #TaxCutsandJobsAct,2017-12-20 18:09:44
"Together , MAKING AMERICA GREAT AGAIN !",2017-12-20 17:30:26
I would like congratulate @SenateMajLdr done fantastic job strategically & politically passing Senate MASSIVE TAX CUT & Reform Bill . I could asked better talented partner . Our team go onto many VICTORIES !,2017-12-20 16:39:04
"The Tax Cuts large meaningful , yet Fake News working overtime follow lead friends , defeated Dems , demean . This truly case results speak , starting soon . Jobs , Jobs , Jobs !",2017-12-20 14:32:51
"The United States Senate passed biggest history Tax Cut Reform Bill . Terrible Individual Mandate ( ObamaCare ) Repealed . Goes House tomorrow morning final vote . If approved , News Conference The White House approximately 1:00 P . M .",2017-12-20 06:09:06
"Congratulations Paul Ryan , Kevin McCarthy , Kevin Brady , Steve Scalise , Cathy McMorris Rodgers great House Republicans voted favor cutting taxes !",2017-12-19 20:18:12
A story @washingtonpost I close “ rescinding ” nomination Justice Gorsuch prior confirmation FAKE NEWS . I never even wavered proud job Justice U . S . Supreme Court . The unnamed sources ’ exist !,2017-12-19 15:07:01
"Stocks economy long way go Tax Cut Bill totally understood appreciated scope size . Immediate expensing big impact . Biggest Tax Cuts Reform EVER passed . Enjoy , create many beautiful JOBS !",2017-12-19 11:23:40
DOW RISES 5000 POINTS ON THE YEAR FOR THE FIRST TIME EVER - MAKE AMERICA GREAT AGAIN !,2017-12-19 11:04:11
"Together , task strengthen families , build communities , serve citizens , celebrate AMERICAN GREATNESS shining example world ...",2017-12-19 00:54:32
"With strategy I announced today , declaring AMERICA game AMERICA DETERMINED WIN ! OUR FOUR PILLARS OF NATIONAL SECURITY STRATEGY :",2017-12-18 23:49:30
70 Record Closes Dow far year ! We NEVER 70 Dow Records one year period . Wow !,2017-12-18 22:25:20
Thank Maria B !,2017-12-18 22:20:20
So true Ivanka !,2017-12-18 22:18:13
"As world watches , days away passing HISTORIC TAX CUTS American families businesses . It BIGGEST TAX CUT TAX REFORM HISTORY country !",2017-12-18 20:40:08
"When American People speak , ALL OF US listen . Just one year ago , spoke loud clear . On November 8 , 2016 , voted MAKE AMERICA GREAT AGAIN !",2017-12-18 20:28:19
"Over past 11 months , I travelled tens thousands miles , visit 13 countries . I met 100 world leaders everywhere I traveled , highest privilege greatest honor represent AMERICAN PEOPLE !",2017-12-18 20:19:18
Our deepest sympathies heartfelt prayers victims train derailment Washington State . We closely monitoring situation coordinating local authorities ...,2017-12-18 19:35:38
"My thoughts prayers everyone involved train accident DuPont , Washington . Thank wonderful First Responders scene . We currently monitoring White House .",2017-12-18 18:51:26
"The train accident occurred DuPont , WA shows ever soon submitted infrastructure plan must approved quickly . Seven trillion dollars spent Middle East roads , bridges , tunnels , railways ( ) crumble ! Not long !",2017-12-18 18:41:05
Ivanka Trump interviewed @foxandfriends .,2017-12-18 11:42:18
"Remember , Republicans 5-0 Congressional Races year . The media refuses mention . I said Gillespie Moore would lose ( different reasons ) , . I also predicted “ I ” would win . Republicans well 2018 , well ! @foxandfriends",2017-12-18 11:23:49
"More century conquering flight , #WrightBrothers continue motivate & inspire Americans , never tire exploration & innovation . This GREAT AMERICAN SPIRIT found design every new supersonic jet next generation :",2017-12-18 00:26:07
Wonderful weekend Camp David . A special place . A lot important work done . Heading back @WhiteHouse .,2017-12-17 21:13:34
"As candidate , I promised would pass massive TAX CUT everyday working American families backbone heartbeat country . Now , days away ...",2017-12-17 17:01:58
WEEKLY ADDRESS 🇺 🇸,2017-12-16 20:31:43
"TAX CUTS increase investment American economy U . S . workers , leading higher growth , higher wages , JOBS !",2017-12-16 20:05:05
"Congratulations two great hardworking guys , Corey Lewandowski David Bossie , success book , “ Let Trump Be Trump . ” Finally people real knowledge writing wonderful exciting campaign !",2017-12-16 14:52:03
"Great job Kevin , proud !",2017-12-16 03:12:37
"DOW , S & P 500 NASDAQ close record highs ! #MAGA",2017-12-16 00:00:11
"Today , tremendous honor visit Marine Helicopter Squadron One ( HMX - 1 ) Marine Corps Air Facility Quantico , Virginia . I honored serve Commander-in-Chief . On behalf entire Nation , THANK YOU sacrifice service . We love !",2017-12-15 21:58:12
"You always us – THE MEN AND WOMEN IN BLUE . Thank police , thank sheriffs , thank law enforcement families . God Bless , GOD BLESS AMERICA ! #LESM",2017-12-15 19:48:58
"To member graduating class National Academy Quantico , CONGRATULATIONS !",2017-12-15 17:35:59
It honor . THANK YOU !,2017-12-15 13:55:01
“ Manufacturing Optimism Rose Another All-Time High Latest @ShopFloorNAM Outlook Survey ”,2017-12-14 21:20:51
"In 1960 , approximately 20,000 pages Code Federal Regulations . Today 185,000 pages , seen Roosevelt Room . Today , CUT THE RED TAPE ! It time SET FREE OUR DREAMS MAKE AMERICA GREAT AGAIN !",2017-12-14 20:35:13
"When Americans free thrive , innovate , & prosper , challenge great , task large , & goal beyond reach . We nation explorers , pioneers , innovators & inventors . We nation people work hard , dream big , & never , ever give ...",2017-12-14 20:27:00
"Today , gathered Roosevelt Room one single reason : CUT THE RED TAPE ! For many decades , ever-growing maze regs , rules , restrictions cost country trillions dollars , millions jobs , countless American factories , & devastated entire industries .",2017-12-14 20:13:04
"As candidate , I promised would pass massive tax cut everyday , working Americans . If make voices heard , moment forever remembered great new beginning – dawn brilliant American future shining PATRIOTISM , PROSPERITY AND PRIDE !",2017-12-14 17:05:13
"Republican Tax Cuts looking good . All working hard . In meantime , Stock Market hit another record high !",2017-12-14 12:59:56
Thank Omarosa service ! I wish continued success .,2017-12-13 23:58:18
"If last night ’ election proved anything , proved need put GREAT Republican candidates increase razor thin margins House Senate .",2017-12-13 14:45:48
"Wow , 90 % Fake News Media coverage negative , numerous forced retractions untrue stories . Hence use Social Media , way get truth . Much Mainstream Meadia become joke ! @foxandfriends",2017-12-13 13:02:52
"The reason I originally endorsed Luther Strange ( numbers went mightily ) , I said Roy Moore able win General Election . I right ! Roy worked hard deck stacked !",2017-12-13 11:22:04
"Congratulations Doug Jones hard fought victory . The write-in votes played big factor , win win . The people Alabama great , Republicans another shot seat short period time . It never ends !",2017-12-13 04:08:41
Wishing celebrating #Hanukkah around world happy healthy eight nights company love .,2017-12-12 22:13:12
"Consumer Confidence All-Time High , along Record High Stock Market . Unemployment 17 year low . MAKE AMERICA GREAT AGAIN ! Working pass MASSIVE TAX CUTS ( looking good ) .",2017-12-12 14:23:55
"The people Alabama right thing . Doug Jones Pro-Abortion , weak Crime , Military Illegal Immigration , Bad Gun Owners Veterans WALL . Jones Pelosi / Schumer Puppet . Roy Moore always vote us . VOTE ROY MOORE !",2017-12-12 14:09:26
"Lightweight Senator Kirsten Gillibrand , total flunky Chuck Schumer someone would come office “ begging ” campaign contributions long ago ( would anything ) , ring fighting Trump . Very disloyal Bill & Crooked-USED !",2017-12-12 13:03:35
"Despite thousands hours wasted many millions dollars spent , Democrats unable show collusion Russia - moving false accusations fabricated stories women I ’ know / never met . FAKE NEWS !",2017-12-12 12:10:58
"Another false story , time Failing @nytimes , I watch 4-8 hours television day - Wrong ! Also , I seldom , ever , watch CNN MSNBC , I consider Fake News . I never watch Don Lemon , I called “ dumbest man television ! ” Bad Reporting .",2017-12-11 14:17:18
"Very little discussion purposely false defamatory stories put week Fake News Media . They control - correct reporting means nothing . Major lies written , forced withdrawn exposed ... stain America !",2017-12-10 21:18:40
"Getting closer closer Tax Cut Bill . Shaping even better projected . House Senate working hard smart . End result important , SPECIAL !",2017-12-10 13:35:28
"Things going really well economy , subject Fake News spends little time possible discussing ! Stock Market hit another RECORD HIGH , unemployment 17 year low companies coming back USA . Really good news , much come !",2017-12-10 13:30:44
No American separated loved ones preventable crime committed illegally country . Our cities Sanctuaries Americans – criminal aliens !,2017-12-10 02:17:25
Great Army - Navy Game . Army wins 14 13 brings home COMMANDER-IN-CHIEF ’ S TROPHY ! Congratulations !,2017-12-09 23:47:55
". @daveweigel Washington Post admitted picture FAKE ( fraud ? ) showing almost empty arena last night speech Pensacola , fact , knew arena packed ( shown also T . V . ) . FAKE NEWS , fired .",2017-12-09 23:14:34
". @DaveWeigel @WashingtonPost put phony photo empty arena hours I arrived @ venue , w / thousands people outside , way . Real photos shown I spoke . Packed house , many people unable get . Demand apology & retraction FAKE NEWS WaPo !",2017-12-09 22:01:44
"Have great game today , @USArmy @USNavy - I watching . We love U . S . Military . On behalf entire Nation , THANK YOU sacrifice service ! #ArmyNavyGame #USA 🇺 🇸",2017-12-09 18:37:31
"It great honor celebrate opening two extraordinary museums-the Mississippi State History Museum & Mississippi Civil Rights Museum . We pay solemn tribute heroes past & dedicate building future freedom , equality , justice & peace .",2017-12-09 18:19:31
"Heading great state Mississippi invitation popular respected Governor , @PhilBryantMS . Look forward seeing new Civil Rights Museum !",2017-12-09 15:45:47
"CNN ’ S slogan CNN , THE MOST TRUSTED NAME IN NEWS . Everyone knows true , could , fact , fraud American Public . There many outlets far trusted Fake News CNN . Their slogan CNN , THE LEAST TRUSTED NAME IN NEWS !",2017-12-09 13:21:24
"Fake News CNN made vicious purposeful mistake yesterday . They caught red handed , like lonely Brian Ross ABC News ( immediately fired “ mistake ” ) . Watch see @CNN fires responsible , gross incompetence ?",2017-12-09 13:02:23
"A big contingent enthusiastic Roy Moore fans rally last night . We ’ Pelosi / Schumer Liberal Democrat , Jones , important Alabama Senate seat . Need vote Make America Great Again ! Jones always vote must Country .",2017-12-09 12:52:18
"GREAT EVENING last night Pensacola , Florida . Arena packed rafters , crowd loud , loving really smart . They definitely get ’ going . Thank Pensacola !",2017-12-09 12:41:39
"We believe every American stand National Anthem , proudly pledge allegiance one NATION UNDER GOD !",2017-12-09 06:06:03
"This land , home , voice matters . So speak , heard , fight , fight , fight change waiting entire life ! MERRY CHRISTMAS THANK YOU Pensacola , Florida !",2017-12-09 04:46:05
Just arrived Pensacola Bay Center . Join LIVE @FoxNews 10 minutes ! #MAGA,2017-12-09 01:04:16
"On way Pensacola , Florida . See everyone soon ! #MAGA",2017-12-08 23:25:06
"“ The unemployment rate remains 17 - year low 4.1 % . The unemployment rate manufacturing dropped 2.6 % , lowest ever recorded . The unemployment rate among Hispanics dropped 4.7 % , lowest ever recorded ... ” @SecretaryAcosta @USDOL",2017-12-08 19:02:27
MAKE AMERICA GREAT AGAIN !,2017-12-08 17:46:21
"Fines penalties Wells Fargo Bank bad acts customers others dropped , incorrectly reported , pursued , anything , substantially increased . I cut Regs make penalties severe caught cheating !",2017-12-08 15:18:27
"LAST thing Make America Great Again Agenda needs Liberal Democrat Senate little margin victory already . The Pelosi / Schumer Puppet Jones would vote us 100 % time . He ’ bad Crime , Life , Border , Vets , Guns & Military . VOTE ROY MOORE !",2017-12-08 15:06:55
"Big crowd expected today Pensacola , Florida , Make America Great Again speech . We done much short period time ... yet planning much ! See !",2017-12-08 13:11:43
I fulfilled campaign promise - others ’ !,2017-12-08 05:41:08
"Tonight , @FLOTUS Melania I thrilled welcome many wonderful friends @WhiteHouse – wish #HappyHanukkah",2017-12-08 05:36:09
"Across battlefields , oceans , harrowing skies Europe Pacific throughout war , one great battle cry could heard America ’ friends foes alike : “ REMEMBER PEARL HARBOR . ”",2017-12-07 21:10:28
"Today , Remember Pearl Harbor , incredible honor joined surviving Veterans attack 12/7 / 1941 . They HEROES , living witnesses American History . All American hearts filled gratitude service sacrifice .",2017-12-07 20:52:49
"Today , U . S . flag flies half-staff @WhiteHouse , honor National Pearl Harbor Remembrance Day .",2017-12-07 20:04:20
"Today , entire nation pauses REMEMBER PEARL HARBOR — brave warriors day stood tall fought America . God Bless HEROES wear uniform , God Bless United States America . #PearlHarborRemembranceDay 🇺 🇸",2017-12-07 16:16:19
"National Pearl Harbor Remembrance Day - “ A day live infamy ! ” December 7 , 1941",2017-12-07 15:04:54
Go get new book Andrew Jackson Brian Kilmeade ... Really good . @foxandfriends,2017-12-07 13:08:02
I determined time officially recognize Jerusalem capital Israel . I also directing State Department begin preparation move American Embassy Tel Aviv Jerusalem ...,2017-12-06 21:14:41
Join live @WhiteHouse via #Periscope,2017-12-06 18:05:04
Our thoughts prayers everyone path California ’ wildfires . I encourage everyone heed advice orders local state officials . THANK YOU First Responders incredible work !,2017-12-06 16:11:55
MAKE AMERICA GREAT AGAIN !,2017-12-06 15:00:03
"Join Friday Pensacola , Florida Pensacola Bay Center ! Tickets :",2017-12-05 23:13:28
"Yesterday , I thrilled many WONDERFUL friends , Utah ’ MAGNIFICENT Capitol . It honor sign two Presidential Proclamations modify national monuments designations Bears Ears Grand Staircase Escalante ...",2017-12-05 17:46:45
A must watch : Legal Scholar Alan Dershowitz @foxandfriends talking going respect greatest Witch Hunt U . S . political history . Enjoy !,2017-12-04 12:35:39
"With great vote Cutting Taxes , could big day Stock Market - YOU !",2017-12-04 12:03:18
"Putting Pelosi / Schumer Liberal Puppet Jones office Alabama would hurt great Republican Agenda low taxes , tough crime , strong military borders ... & much . Look 401 - k ’ since Election . Highest Stock Market EVER ! Jobs roaring back !",2017-12-04 12:00:08
"Democrats refusal give even one vote massive Tax Cuts need Republican Roy Moore win Alabama . We need vote stopping crime , illegal immigration , Border Wall , Military , Pro Life , V . A . , Judges 2nd Amendment . No Jones , Pelosi / Schumer Puppet !",2017-12-04 11:17:05
Report : “ ANTI-TRUMP FBI AGENT LED CLINTON EMAIL PROBE ” Now starts make sense !,2017-12-03 13:36:45
"People lost money Stock Market went 350 points based False Dishonest reporting Brian Ross @ABC News ( suspended ) , consider hiring lawyer suing ABC damages bad reporting caused - many millions dollars !",2017-12-03 13:15:21
"After years Comey , phony dishonest Clinton investigation ( ) , running FBI , reputation Tatters - worst History ! But fear , bring back greatness .",2017-12-03 13:00:47
"Tainted ( , dishonest ? ) FBI “ agent ’ role Clinton probe review . ” Led Clinton Email probe . @foxandfriends Clinton money going wife another FBI agent charge .",2017-12-03 12:42:47
Such total miscarriage Justice San Francisco !,2017-12-03 12:27:54
I never asked Comey stop investigating Flynn . Just Fake News covering another Comey lie !,2017-12-03 11:15:02
"Congratulations @ABC News suspending Brian Ross horrendously inaccurate dishonest report Russia , Russia , Russia Witch Hunt . More Networks “ papers ” Fake News !",2017-12-03 02:22:40
"Many people Country asking “ Justice ” Department going fact totally Crooked Hillary , AFTER receiving subpoena United States Congress , deleted “ acid washed ” 33,000 Emails ? No justice !",2017-12-03 02:13:28
"So General Flynn lies FBI life destroyed , Crooked Hillary Clinton , famous FBI holiday “ interrogation ” swearing recording , lies many times ... nothing happens ? Rigged system , double standard ?",2017-12-03 02:06:54
Great job First Lady Melania !,2017-12-03 01:50:15
"62 years ago week , brave seamstress Montgomery , Alabama uttered one word changed history ...",2017-12-02 21:07:59
I fire General Flynn lied Vice President FBI . He pled guilty lies . It shame actions transition lawful . There nothing hide !,2017-12-02 17:14:13
Biggest Tax Bill Tax Cuts history passed Senate . Now great Republicans going final passage . Thank House Senate Republicans hard work commitment !,2017-12-02 12:54:37
We one step closer delivering MASSIVE tax cuts working families across America . Special thanks @SenateMajLdr Mitch McConnell Chairman @SenOrrinHatch shepherding bill Senate . Look forward signing final bill Christmas !,2017-12-02 07:49:18
Economists TAX CUTS JOBS ACT : “ The enactment comprehensive overhaul - complete lower corporate tax rate - IGNITE ECONOMY levels GROWTH SEEN IN GENERATIONS ... ”,2017-12-01 21:49:27
"The media speculating I fired Rex Tillerson would leaving soon - FAKE NEWS ! He ’ leaving disagree certain subjects , ( I call final shots ) work well together America highly respected !",2017-12-01 20:08:22
Republicans Senators working hard pass biggest Tax Cuts history Country . The Bill getting better better . This generation chance . Obstructionist Dems trying block think good given credit !,2017-12-01 11:21:06
