"Great conversations President @EmmanuelMacron representatives trade , military security .",2017-07-14 13:47:19
"The United States mourns victims Nice , France . We pledge solidarity France terror . 🇺 🇸 🇫 🇷",2017-07-14 13:39:47
It great honor represent United States magnificent #BastilleDay parade . Congratulations President @EmmanuelMacron !,2017-07-14 11:04:16
. @VP Mike Pence working hard HealthCare getting wonderful Republican Senators right people .,2017-07-14 08:09:05
"After years suffering thru ObamaCare , Republican Senators must come promised !",2017-07-14 08:07:29
"So impt Rep Senators , leadership @SenateMajLdr McConnell get healthcare plan approved . After 7yrs O'Care disaster , must happen !",2017-07-14 08:05:36
"Republicans Senators working hard get failed ObamaCare replacement approved . I desk , pen hand !",2017-07-14 07:57:33
Great evening President @EmmanuelMacron & Mrs . Macron . Went Eiffel Tower dinner . Relationship France stronger ever .,2017-07-14 07:56:26
Great bilateral meetings Élysée Palace w / President @EmmanuelMacron . The friendship two nations unbreakable .,2017-07-13 19:20:56
"President @EmmanuelMacron , Thank beautiful welcome ceremony Les Invalides today !",2017-07-13 18:45:49
"Melania I thrilled join dedicated men women @USEmbassyFrance , members U . S . Military families .",2017-07-13 12:50:16
"Just landed Paris , France @FLOTUS Melania .",2017-07-13 08:06:11
Big WIN today building wall . It secure border & save lives . Now full House & Senate must act ! ➡ ️,2017-07-12 23:24:08
"JOBS , JOBS , JOBS ! #MAGA 🇺 🇸",2017-07-12 23:12:03
Stock market hits another high spirit enthusiasm positive . Jobs outlook looking good ! #MAGA 🇺 🇸,2017-07-12 23:06:19
Getting rdy leave France @ invitation President Macron celebrate & honor Bastille Day 100yrs since U . S . entry WWI .,2017-07-12 22:35:53
""" After 14 years , U . S . beef hits Chinese market . Trade deal exciting opportunity agriculture . """,2017-07-12 20:20:56
"The W . H . functioning perfectly , focused HealthCare , Tax Cuts / Reform & many things . I little time watching T . V .",2017-07-12 13:39:25
Why standards placed Democrats . Look Hillary Clinton may gotten away . Disgraceful !,2017-07-12 13:27:03
". @WashTimes states "" Democrats willfully used Moscow disinformation influence presidential election Donald Trump . """,2017-07-12 12:12:42
"ISIS run & soon wiped Syria & Iraq , illegal border crossings way ( 75 % ) & MS 13 gangs removed .",2017-07-12 11:05:53
"Remember , hear words "" sources say "" Fake Media , often times sources made exist .",2017-07-12 10:32:56
"My son Donald good job last night . He open , transparent innocent . This greatest Witch Hunt political history . Sad !",2017-07-12 10:19:32
"My son , Donald , interviewed @seanhannity tonight 10:00 P . M . He great person loves country !",2017-07-12 00:24:10
Big wins ISIS !,2017-07-11 12:23:45
Marine Plane crash Mississippi heartbreaking . Melania I send deepest condolences !,2017-07-11 12:09:22
Working hard get Olympics United States ( L . A . ) . Stay tuned !,2017-07-11 11:46:00
The Senate Democrats confirmed 48 197 Presidential Nominees . They can't win slow things & obstruct !,2017-07-11 10:59:58
"If Chelsea Clinton asked hold seat mother , mother gave country away , Fake News would say CHELSEA FOR PRES !",2017-07-10 11:47:49
"When I left Conference Room short meetings Japan countries , I asked Ivanka hold seat . Very standard . Angela M agrees !",2017-07-10 11:31:33
I cannot imagine Congress would dare leave Washington without beautiful new HealthCare bill fully approved ready go !,2017-07-10 10:47:33
James Comey leaked CLASSIFIED INFORMATION media . That illegal !,2017-07-10 10:40:16
"The fact President Putin I discussed Cyber Security unit mean I think happen . It can't-but ceasefire , & !",2017-07-10 00:45:13
Syrian ceasefire seems holding . Many lives saved . Came meeting . Good !,2017-07-09 20:09:52
"For years , even "" civilian , "" I listened Republicans pushed Repeal Replace ObamaCare . Now finally chance !",2017-07-09 20:07:11
MAKE AMERICA GREAT AGAIN !,2017-07-09 12:57:58
Sanctions discussed meeting President Putin . Nothing done Ukrainian & Syrian problems solved !,2017-07-09 12:31:23
... . Fake News said 17 intel agencies actually 4 ( apologize ) . Why Obama NOTHING info election ?,2017-07-09 12:06:30
"... safe . Questions asked CIA & FBI ask DNC 13 times SERVER , rejected , still ...",2017-07-09 11:57:55
"Putin & I discussed forming impenetrable Cyber Security unit election hacking , & many negative things , guarded ..",2017-07-09 11:50:24
... We negotiated ceasefire parts Syria save lives . Now time move forward working constructively Russia !,2017-07-09 11:37:42
I strongly pressed President Putin twice Russian meddling election . He vehemently denied . I've already given opinion ...,2017-07-09 11:31:22
The G 20 Summit great success U . S . - Explained U . S . must fix many bad trade deals made . Will get done !,2017-07-09 11:15:58
"Thank @SenatorDole , kind !",2017-07-09 00:29:21
"Leaving Hamburg Washington , D . C . WH . Just left China ’ President Xi excellent meeting trade & North Korea .",2017-07-08 18:55:23
Law enforcement & military spectacular job Hamburg . Everybody felt totally safe despite anarchists . @PolizeiHamburg #G20Summit,2017-07-08 18:50:10
The #G20Summit wonderful success carried beautifully Chancellor Angela Merkel . Thank !,2017-07-08 18:20:56
We fight #FakeNews !,2017-07-08 18:17:24
"Great first day world leaders #G20Summit Hamburg , Germany . Looking forward day two ! #USA",2017-07-07 23:33:26
Thank ! “ Trump ’ Defining Speech ” WSJ Editorial :,2017-07-07 21:56:53
I represent country well fight interests ! Fake News Media never cover accurately cares ! We #MAGA !,2017-07-07 07:44:07
"I look forward meetings today world leaders , including meeting Vladimir Putin . Much discuss . #G20Summit #USA 🇺 🇸",2017-07-07 07:42:37
Everyone talking John Podesta refused give DNC server FBI CIA . Disgraceful !,2017-07-07 07:40:42
After Poland great meeting Chancellor Merkel PM Shinzō Abe Japan & President Moon South Korea .,2017-07-07 07:07:20
"My experience yesterday Poland great one . Thank everyone , including haters , great reviews speech !",2017-07-07 06:59:02
"A strong Poland blessing nations Europe , strong Europe blessing West , world .",2017-07-06 20:45:21
THE WEST WILL NEVER BE BROKEN . Our values PREVAIL . Our people THRIVE civilization TRIUMPH !,2017-07-06 17:21:18
America proud stand shoulder-to-shoulder Poland fight eradicate evils terrorism extremism . #POTUSinPoland,2017-07-06 16:02:25
"On behalf @FLOTUS Melania , thank Poland ! 🇺 🇸 🇵 🇱 #ICYMI , watch ➡ ️",2017-07-06 14:02:13
Congratulations dedicated professionals USSS celebrate 152nd anniversary . Thank ! ➡ ️,2017-07-05 23:23:42
Trade China North Korea grew almost 40 % first quarter . So much China working us - give try !,2017-07-05 11:21:23
The United States made worst Trade Deals world history.Why continue deals countries help us ?,2017-07-05 11:14:11
"Getting ready leave Poland , I travel Germany G - 20 . Will back Saturday .",2017-07-05 10:51:59
#HappyIndependenceDay #USA 🇺 🇸,2017-07-05 02:19:23
Gas prices lowest U . S . ten years ! I would like see go even lower .,2017-07-04 19:55:28
Getting ready celebrate 4th July big crowd White House . Happy 4th everyone . Our country grow prosper !,2017-07-04 19:49:16
#HappyIndependenceDay #July4 #USA 🇺 🇸,2017-07-04 10:38:40
... Japan put much longer . Perhaps China put heavy move North Korea end nonsense !,2017-07-04 02:24:39
North Korea launched another missile . Does guy anything better life ? Hard believe South Korea ...,2017-07-04 02:19:02
Dow hit new intraday all-time high ! I wonder whether Fake News Media report ?,2017-07-03 21:10:25
"Really great numbers jobs & economy ! Things starting kick , begun ! Don't like steel & aluminum dumping !",2017-07-03 20:54:08
Thank Shawn Steel nice words @FoxNews .,2017-07-03 20:44:27
"If help little #CharlieGard , per friends U . K . Pope , would delighted .",2017-07-03 14:00:21
"At point Fake News forced discuss great jobs numbers , strong economy , success ISIS , border & much else !",2017-07-03 12:10:44
Will speaking Italy morning !,2017-07-03 11:38:20
Spoke yesterday King Saudi Arabia peace Middle-East . Interesting things happening !,2017-07-03 11:19:08
Will speaking Germany France morning .,2017-07-03 11:00:56
"America's men & women uniform story FREEDOM overcoming OPPRESSION , STRONG protecting WEAK , & GOOD defeating EVIL ! USA 🇺 🇸",2017-07-03 02:13:07
"Stock Market time high , unemployment lowest level years ( wages start going ) base never stronger !",2017-07-02 23:55:23
The dishonest media NEVER keep us accomplishing objectives behalf GREAT AMERICAN PEOPLE ! #AmericaFirst 🇺 🇸,2017-07-02 20:04:24
#FraudNewsCNN #FNN,2017-07-02 13:21:42
"We always take care GREAT VETERANS . You shed blood , poured love , bared soul , defense country .",2017-07-02 04:47:04
My use social media Presidential - ’ MODERN DAY PRESIDENTIAL . Make America Great Again !,2017-07-01 22:41:58
I thinking changing name #FakeNews CNN #FraudNewsCNN !,2017-07-01 22:08:37
"... 2016 election interviews , speeches social media . I beat #FakeNews , . We continue WIN !",2017-07-01 22:02:27
"The FAKE & FRAUDULENT NEWS MEDIA working hard convince Republicans others I use social media - remember , I ...",2017-07-01 22:02:12
Getting rdy leave tonight's Celebrate Freedom Concert honoring GREAT VETERANS w / many evangelical friends . See soon !,2017-07-01 21:38:32
Weekly Address 🇺 🇸 #KatesLaw #NoSanctuaryForCriminalsAct Statement :,2017-07-01 21:01:20
"Crazy Joe Scarborough dumb rock Mika bad people , low rated show dominated NBC bosses . Too bad !",2017-07-01 13:20:35
I extremely pleased see @CNN finally exposed #FakeNews garbage journalism . It's time !,2017-07-01 13:12:40
Numerous states refusing give information distinguished VOTER FRAUD PANEL . What trying hide ?,2017-07-01 13:07:05
Word @Greta Van Susteren let go control bosses @NBC & @Comcast refused go along w / ' Trump hate ! ',2017-07-01 12:59:52
Happy Canada Day great people Canada Prime Minister new found friend @JustinTrudeau . #Canada150,2017-07-01 12:44:23
America THINK BIG . We inspire millions children carry proud tradition American space leadership !,2017-06-30 22:43:58
The era strategic patience North Korea regime failed . That patience . We working closely ...,2017-06-30 20:55:44
"I encouraged President Moon's assurances work level playing field American workers , businesses , & automakers .",2017-06-30 18:19:13
Watched low rated @Morning_Joe first time long time . FAKE NEWS . He called stop National Enquirer article . I said ! Bad show,2017-06-30 12:55:08
Crime killings Chicago reached epidemic proportions I sending Federal help . 1714 shootings Chicago year !,2017-06-30 10:48:38
"If Republican Senators unable pass working , immediately REPEAL , REPLACE later date !",2017-06-30 10:37:57
Just finished good meeting President South Korea . Many subjects discussed including North Korea new trade deal !,2017-06-30 01:44:01
Our new American Energy Policy unlock MILLIONS jobs & TRILLIONS wealth . We cusp true energy REVOLUTION .,2017-06-29 23:10:47
"When comes future America ’ energy needs , FIND IT , DREAM IT , BUILD IT . #EnergyWeek",2017-06-29 23:09:01
Statement House Passage Kate ’ Law No Sanctuary Criminals Act .,2017-06-29 22:53:49
Good news House passing ' No Sanctuary Criminals Act . ' Hopefully Senate follow .,2017-06-29 22:28:23
"Good news , House passed #KatesLaw . Hopefully Senate follow .",2017-06-29 21:37:02
""" Mattis Says Trump ’ Warning Stopped Chemical Weapons Attack In Syria """,2017-06-29 21:13:22
"Join LIVE @VP , @SecretaryPerry , @SecretaryZinke @EPAScottPruitt . #UnleashingAmericanEnergy",2017-06-29 19:31:13
MAKE AMERICA SAFE AGAIN ! #NoSanctuaryForCriminalsAct #KatesLaw #SaveAmericanLives,2017-06-29 18:13:16
"Today , House votes two crucial bills : ☑ ️ #NoSanctuaryForCriminalsAct ☑ ️ #KatesLaw ☑ ️ Pass bills & lets MAKE AMERICA SAFE AGAIN 🇺 🇸",2017-06-29 16:53:44
"... Mar-a-Lago 3 nights row around New Year's Eve , insisted joining . She bleeding badly face-lift . I said !",2017-06-29 12:58:23
"I heard poorly rated @Morning_Joe speaks badly ( watch anymore ) . Then come low I . Q . Crazy Mika , along Psycho Joe , came ..",2017-06-29 12:52:17
New Sugar deal negotiated Mexico good one Mexico U . S . Had deal many years hurt U . S . badly .,2017-06-29 12:27:35
Tomorrow House votes #KatesLaw & No Sanctuary For Criminals Act . Lawmakers must vote put American safety first ! #SaveAmericanLives,2017-06-29 01:51:18
"From first day office , ’ taken swift action lift crushing restrictions American energy . Remarks :",2017-06-28 22:32:47
Democrats purposely misstated Medicaid new Senate bill - actually goes .,2017-06-28 21:26:27
"Today , I hosted immigration roundtable ahead two votes taking place Congress tomorrow . Watch read :",2017-06-28 21:15:37
It great honor welcome 2016 World Series Champion Chicago @Cubs ⚾ ️ @WhiteHouse afternoon . Congratulations !,2017-06-28 21:06:39
"#ICYMI - Monday , I great honor welcoming India's Prime Minister @narendramodi WH . Full Remarks :",2017-06-28 20:19:38
"The #AmazonWashingtonPost , sometimes referred guardian Amazon paying internet taxes ( ) FAKE NEWS !",2017-06-28 13:06:14
"Some Fake News Media likes say I totally engaged healthcare . Wrong , I know subject well & want victory U . S .",2017-06-28 10:58:59
The failing @nytimes writes false story false story . They even call verify facts story . A Fake News Joke !,2017-06-28 10:49:22
"I finished great meeting Republican Senators concerning HealthCare . They really want get right , unlike OCare !",2017-06-27 22:27:48
"With ZERO Democrats help , failed , expensive dangerous ObamaCare Dems legacy , Republican Senators working hard !",2017-06-27 22:22:55
"So caught Fake News CNN cold , NBC , CBS & ABC ? What failing @nytimes & @washingtonpost ? They Fake News !",2017-06-27 12:47:17
Fake News CNN looking big management changes got caught falsely pushing phony Russian stories . Ratings way !,2017-06-27 12:30:38
"Wow , CNN retract big story "" Russia , "" 3 employees forced resign . What phony stories ? FAKE NEWS !",2017-06-27 10:33:42
"Great day America's future Security Safety , courtesy U . S . Supreme Court . I keep fighting American people , & WIN !",2017-06-27 02:31:16
"From @FoxNews "" Bombshell : In 2016 , Obama dismissed idea anyone could rig American election . "" Check statement - Witch Hunt !",2017-06-27 02:24:30
Very grateful 9 - O decision U . S . Supreme Court . We must keep America SAFE !,2017-06-26 18:25:18
"Republican Senators working hard get , help Democrats . Not easy ! Perhaps let OCare crash & burn !",2017-06-26 13:14:24
".. magnifying glass , zero "" tapes "" T people colluding . There collusion & obstruction . I given apology !",2017-06-26 13:05:01
The real story President Obama NOTHING informed August Russian meddling . With 4 months looking Russia ...,2017-06-26 12:59:31
"... want "" rock boat . "" He "" choke , "" colluded obstructed , Dems Crooked Hillary good .",2017-06-26 12:50:15
The reason President Obama NOTHING Russia notified CIA meddling expected Clinton would win ..,2017-06-26 12:37:16
"The Democrats become nothing OBSTRUCTIONISTS , policies ideas . All delay complain.They ObamaCare !",2017-06-26 12:30:12
Hillary Clinton colluded Democratic Party order beat Crazy Bernie Sanders . Is allowed collude ? Unfair Bernie !,2017-06-25 12:00:37
MAKE AMERICA GREAT AGAIN !,2017-06-24 21:23:52
I cannot imagine fine Republican Senators would allow American people suffer broken ObamaCare longer !,2017-06-24 20:50:56
"Obama Administration official said "" choked "" came acting Russian meddling election . They want hurt Hillary ?",2017-06-24 20:44:36
"Since Obama Administration told way 2016 Election Russians meddling , action ? Focus , T !",2017-06-24 20:28:46
"Democrats slam GOP healthcare proposal Obamacare premiums & deductibles increase 100 % . Remember keep doctor , keep plan ?",2017-06-24 12:51:33
Just : The Obama Administration knew far advance November 8th election meddling Russia . Did nothing . WHY ?,2017-06-24 00:43:48
WEEKLY ADDRESS 🇺 🇸,2017-06-23 21:32:29
"Today , tremendous honor sign #VAaccountability Act law , delivering campaign promise #AmericanHeroes !",2017-06-23 19:56:29
"I've helped pass signed 38 Legislative Bills , mostly Democratic support , gotten rid massive amounts regulations . Nice !",2017-06-23 10:39:50
Will @foxandfriends . Enjoy !,2017-06-23 10:07:50
. @FLOTUS & I honored host first WH Congressional Picnic . A wonderful evening & tradition . @MarineBand :,2017-06-23 02:33:37
We're thinking @SteveScalise ! #TeamScalise,2017-06-22 23:27:50
"Together , going MAKE AMERICA GREAT AGAIN ! #AmericaFirst 🇺 🇸",2017-06-22 23:12:12
"I supportive Senate #HealthcareBill . Look forward making really special ! Remember , ObamaCare dead .",2017-06-22 22:40:27
"Mexico ranked second deadliest country world , Syria . Drug trade largely cause . We BUILD THE WALL !",2017-06-22 22:15:39
"As promised , campaign MS - 13 gang continues . "" @ICEgov Busts 39 MS - 13 Members New York Operation """,2017-06-22 21:49:07
"... whether "" tapes "" recordings conversations James Comey , I make , , recordings .",2017-06-22 16:55:02
"With recently reported electronic surveillance , intercepts , unmasking illegal leaking information , I idea ...",2017-06-22 16:54:50
I certainly hope Democrats force Nancy P . That would bad Republican Party - please let Cryin ' Chuck stay !,2017-06-22 14:15:48
"... Why DNC REFUSE turn Server FBI , still ? It's big Dem scam excuse losing election !",2017-06-22 14:08:50
... Why Democratic National Committee turn DHS offer protect hacks ( long prior election ) . It's big Dem HOAX !,2017-06-22 14:01:10
"By way , Russia working hard 2016 Election , took place Obama Admin . Why stop ?",2017-06-22 13:22:04
Former Homeland Security Advisor Jeh Johnson latest top intelligence official state grand scheme Trump & Russia .,2017-06-22 13:18:09
Great night Iowa - special people . Thank !,2017-06-22 11:11:25
Thank Kirkwood Community College . Heading U . S . Cellular Center 8p mE MAKE AMERICA GREAT AGAIN RALLY !,2017-06-21 23:48:58
Just landed Iowa . See everyone soon ! #MAGA 🇺 🇸,2017-06-21 23:04:54
"Democrats would much better party got together Republicans Healthcare , Tax Cuts , Security . Obstruction work !",2017-06-21 10:32:46
"Well , Special Elections want MAKE AMERICA GREAT AGAIN 5 O ! All Fake News , money spent = 0",2017-06-21 03:48:37
Ralph Norman ran fantastic race win Great State South Carolina's 5th District . We honored success tonight !,2017-06-21 03:12:00
"Congratulations Karen Handel big win Georgia 6th . Fantastic job , proud !",2017-06-21 02:41:23
"Thank @FoxNews "" Huge win President Trump GOP Georgia Congressional Special Election . """,2017-06-21 02:33:40
Things looking great Karen H !,2017-06-21 02:21:36
It great honor welcome President Petro Poroshenko Ukraine @WhiteHouse today @VP Pence . ➡ ️,2017-06-21 01:42:59
"While I greatly appreciate efforts President Xi & China help North Korea , worked . At least I know China tried !",2017-06-20 18:38:11
The U . S . condemns brutality North Korean regime mourn latest victim . Video :,2017-06-20 16:41:10
"KAREN HANDEL FOR CONGRESS . She fight lower taxes , great healthcare strong security-a hard worker never give ! VOTE TODAY",2017-06-20 10:02:06
"Democrat Jon Ossoff , wants raise taxes highest level weak crime security , even live district .",2017-06-20 09:49:50
"Big day tomorrow Georgia South Carolina . ObamaCare dead . Dems want raise taxes big ! They obstruct , ideas . Vote "" R """,2017-06-20 00:45:00
Melania I offer deepest condolences family Otto Warmbier . Full statement :,2017-06-19 23:44:02
It great honor welcome President @JC_Varela & Mrs . Varela Panama afternoon . 🇺 🇸 🇵 🇦 ➡ ️,2017-06-19 21:53:56
"... even live ! He wants raise taxes kill healthcare . On Tuesday , #VoteKarenHandel .",2017-06-19 20:35:37
Karen Handel's opponent #GA06 can't even vote district wants represent ...,2017-06-19 20:34:11
... getting great border security healthcare . #VoteRalphNorman tomorrow !,2017-06-19 20:27:27
"Ralph Norman , running Congress SC's 5th District , fantastic help cutting taxes , ...",2017-06-19 20:27:10
My heartfelt thoughts prayers 7 @USNavy sailors #USSFitzgerald families . ➡ ️,2017-06-19 20:15:07
"The Dems want stop tax cuts , good healthcare Border Security.Their ObamaCare dead 100 % increases P's . Vote Karen H",2017-06-19 12:27:01
Camp David special place . An honor spent weekend . Military runs well proud !,2017-06-18 21:51:39
"The new Rasmussen Poll , one accurate 2016 Election , Trump 50 % Approval Rating.That ' higher O's # ' !",2017-06-18 11:02:04
"... massive regulation cuts , 36 new legislative bills signed , great new S.C.Justice , Infrastructure , Healthcare Tax Cuts works !",2017-06-18 10:46:35
"The MAKE AMERICA GREAT AGAIN agenda well despite distraction Witch Hunt . Many new jobs , high business enthusiasm , ..",2017-06-18 10:38:51
Thoughts prayers sailors USS Fitzgerald families . Thank Japanese allies assistance .,2017-06-17 14:08:48
Back Miami Cuban / American friends happy I signed today . Another campaign promise I forget !,2017-06-17 01:30:08
""" National Security Presidential Memorandum Strengthening Policy United States Toward Cuba "" Memorandum ➡ ️",2017-06-16 22:32:20
""" Remarks President Trump Policy U . S . A . Towards Cuba "" Video :",2017-06-16 22:18:54
Great news ! #MAGA,2017-06-16 15:12:27
I investigated firing FBI Director man told fire FBI Director ! Witch Hunt,2017-06-16 13:07:55
"Despite phony Witch Hunt going America , economic & jobs numbers great . Regulations way , jobs enthusiasm way !",2017-06-16 12:54:22
The Fake News Media hates I use turned powerful Social Media - 100 million people ! I go around,2017-06-16 12:23:08
"After 7 months investigations & committee hearings "" collusion Russians , "" nobody able show proof . Sad !",2017-06-16 11:53:56
#CongressionalBaseballGame ⚾ ️,2017-06-15 23:49:24
Thank Wisconsin ! Tuesday great success #WorkforceWeek @WCTC w / @IvankaTrump & @GovWalker . Remarks :,2017-06-15 21:43:14
"Crooked H destroyed phones w / hammer , ' bleached ' emails , & husband meet w / AG days cleared - & talk obstruction ?",2017-06-15 19:56:01
"Why Hillary Clintons family Dems dealings Russia looked , non-dealings ?",2017-06-15 19:43:31
You witnessing single greatest WITCH HUNT American political history - led bad conflicted people ! #MAGA,2017-06-15 11:57:57
"They made phony collusion Russians story , found zero proof , go obstruction justice phony story . Nice",2017-06-15 10:55:37
"Just left hospital . Rep . Steve Scalise , one truly great people , tough shape - real fighter . Pray Steve !",2017-06-15 01:41:45
"Happy birthday U . S . ARMY soldiers . Thank bravery , sacrifices , & dedication . Proud Commander-in-Chief !",2017-06-14 14:07:31
"Rep . Steve Scalise Louisiana , true friend patriot , badly injured fully recover . Our thoughts prayers .",2017-06-14 12:48:26
"Just got back Wisconsin . Great day , great people !",2017-06-14 02:53:45
The passage @DeptVetAffairs Accountability Whistleblower Protection Act GREAT news veterans ! I look forward signing !,2017-06-13 23:18:19
"Just arrived Wisconsin discuss JOBS , JOBS , JOBS ! #MAGA 🇺 🇸",2017-06-13 20:41:37
"2 million people dropped ObamaCare . It death spiral . Obstructionist Democrats gave , answer = resist !",2017-06-13 13:56:20
"Heading Great State Wisconsin talk JOBS , JOBS , JOBS ! Big progress made Real News reporting .",2017-06-13 13:29:59
Fake News time high . Where apology incorrect stories ? ? ?,2017-06-13 12:48:44
A . G . Lynch made law enforcement decisions political purposes ... gave Hillary Clinton free pass protection . Totally illegal !,2017-06-13 12:45:11
"Well , predicted , 9th Circuit - Ruled TRAVEL BAN dangerous time history country . S . C .",2017-06-13 10:44:16
The Fake News Media never wrong dirty . Purposely incorrect stories phony sources meet agenda hate . Sad !,2017-06-13 10:35:55
Congratulations 2016 @ClemsonFB Tigers ! Full ceremony :,2017-06-13 00:09:54
"Finally held first full @Cabinet meeting today . With great team , restore American prosperity bring real change D . C .",2017-06-12 21:10:10
Congratulations ! ' First New Coal Mine Trump Era Opens Pennsylvania ',2017-06-12 17:59:27
We NEVER FORGET victims lost lives one year ago today horrific #PulseNightClub shooting . #OrlandoUnitedDay,2017-06-12 16:58:25
Ivanka @foxandfriends !,2017-06-12 10:55:27
"Great numbers economy . All work , including passage many bills & regulation killing Executive Orders , kicking !",2017-06-12 02:14:29
"My daughter , Ivanka , @foxandfriends tomorrow morning . Enjoy !",2017-06-12 02:02:23
"The Democrats message , economics , taxes , jobs , failing #Obamacare . They OBSTRUCTIONISTS !",2017-06-11 12:49:00
I believe James Comey leaks far prevalent anyone ever thought possible . Totally illegal ? Very ' cowardly ! ',2017-06-11 12:29:46
"... way . Regulations way . 600,000+ new jobs added . Unemployment 4.3 % . Business economic enthusiasm way - record levels !",2017-06-11 12:23:01
The #FakeNews MSM report great economic news since Election Day . #DOW 16 % . #NASDAQ 19.5 % . Drilling & energy sector ...,2017-06-11 12:22:20
America going build . Under budget ahead schedule . Time put #AmericaFirst ! #InfrastructureWeek,2017-06-10 20:52:00
